<?xml version = "1.0" encoding="UTF-8" ?>

<!-- Document to save game -->
<Scrabble_savegame timestamp="2017-09-10T12:30:00" xmlns:xsi="http://www.w3.org/2001/XMLSchema-instance" xsi:noNamespaceSchemaLocation="template_save_game.xsd">
	
	<Players>

		<Player>
			<Name>John_Doo</Name>
			<Hand>AZER*YU</Hand>
			<Score>123</Score>
		</Player>

		<Player>
			<Name>Mike_Hammer</Name>
			<Hand>AEAEAEF</Hand>
			<Score>41</Score>
		</Player>

	</Players>

	<Board_state>
		<Row>??????????????A</Row>
		<Row>??????????????W</Row>
		<Row>??????????????O</Row>
		<Row>??????????????R</Row>
		<Row>???????TESTWORD</Row>
		<Row>???????E???????</Row>
		<Row>???????S???????</Row>
		<Row>???????T???????</Row>
		<Row>???????I???????</Row>
		<Row>???????N???????</Row>
		<Row>???DOING???????</Row>
		<Row>???????????????</Row>
		<Row>???????????????</Row>
		<Row>???????????????</Row>
		<Row>???????????????</Row>
	</Board_state>

	<Bag_of_letters>AZERTYUIOPQDGJLMNVWPIUYTREZA</Bag_of_letters>
	
</Scrabble_savegame>